start,end,text
00:00,00:01,開始面試囉
00:01,00:03,你好，今天很高興能見到你，首先能簡單介紹一下自己嗎？
00:03,00:06,呃…你好，我是李恩豪，嗯…我畢業於台灣師範大學資訊工程系，最近有在學一些AI的東西，不過我還不是很熟悉，只是有接觸過一些基礎的課程和資料。
00:06,00:10,好的，聽起來不錯，那你在學校有沒有做過什麼專案，或者有特別印象深刻的經歷呢？
00:10,00:14,嗯，有…我曾經參與過一個關於語音助手的專案，當時我們…呃…處理了一些語音數據，我負責資料整理和一些基礎的模型訓練，雖然結果…嗯…有些不如預期吧，還是學到了一些東西。
00:14,00:18,可以說說你在這個專案中遇到的挑戰嗎？或者說有什麼地方讓你覺得比較困難？
00:18,00:22,哦，嗯，最大的挑戰應該是…就是資料的清理吧，特別是語音中的噪音部分，我們…呃…用了幾種方法，但效果還是不太理想。然後模型也訓練得不夠好，結果…有點…嗯，沒有達到預期。
00:22,00:26,這確實是一個技術挑戰，聽起來很有趣，那麼你後來是如何解決這個問題的？
00:26,00:30,其實我覺得最終的解決方案…嗯，就是不停地調整參數，並且有些時候會和同學一起討論。雖然解決方案不算很完美，但總算有些改進。
00:30,00:34,有時候團隊合作能帶來不錯的結果，那你有沒有其他的學習或工作經歷，對你有比較大的影響呢？
00:34,00:38,呃，我在課外也做過一些網頁開發的項目，雖然只是做一些比較簡單的功能，像是資料顯示啊，還有一些前端的調整。嗯…但我對這些工作還是挺感興趣的，雖然經驗沒有很多，還有很多地方需要改進。
00:38,00:42,這聽起來像是你有動手做過一些實際項目，那麼你對於學習新技術有什麼心得嗎？
00:42,00:46,呃，我覺得學新技術挺難的，有時候會被困住，特別是遇到自己不熟悉的領域，像是AI的部分，我就常常查資料，但還是會有些地方…沒辦法一下子掌握。嗯…不過我會試著通過實際操作來加深理解。
00:46,00:50,的確，實踐對學習很有幫助，那麼你如果遇到完全不熟悉的技術挑戰，你會怎麼處理呢？
00:50,00:54,嗯，嗯…我可能會先查一些資料，然後試著自己動手做，當然…如果自己解決不了，我也會請教同學或老師，然後再不行的話就去看一些線上課程，看看有沒有相似的案例可以參考。
00:54,00:58,這樣的學習方法不錯，能夠主動尋求幫助，這對解決問題有很大幫助。那你未來的職業規劃是什麼樣的呢？
00:58,01:02,嗯，這個…我其實還沒有完全想好，我目前對AI和機器學習比較感興趣，但還有很多東西不太懂，可能要再多學一些…所以未來想往這方面發展，但也不是很確定自己具體的方向。
01:02,01:06,這也很正常，畢竟還有很多學習的空間，那如果你加入我們的團隊，你對這個職位有什麼期待呢？
01:06,01:10,嗯…我希望能學到更多的技術，尤其是在AI和數據分析方面，還有一些團隊合作的經驗吧，因為這方面我還比較欠缺，可能需要跟同事們一起努力，提升自己的能力。
01:10,01:14,這是很好的期待，團隊合作確實是非常重要的，最後有沒有什麼想對我們說的？
01:14,01:18,嗯…首先謝謝你們給我這個機會，今天的面試讓我學到了一些東西，我也很期待能加入你們的團隊。如果有機會，我會努力學習，貢獻我的力量。
01:18,01:22,我們也很高興今天能與你面談，謝謝你今天的時間，今天的面試到此結束。
01:22,01:26,謝謝，再見
01:26,01:30,再見
